<?xml version='1.0' encoding='UTF-8'?>
<festival xmlns:xsi="http://www.w3.org/2001/XMLSchema-instance" id="ppf2027" lang="cs" xsi:noNamespaceSchemaLocation="festival.xsd">
  <nazev>Prague Pulse Fest</nazev>
  <mistokonani>
    <ulice>Výstaviště 67</ulice>
    <mesto>Praha</mesto>
    <psc>170 00</psc>
  </mistokonani>
  <popis_festivalu>Prague Pulse Fest je fiktivní třídenní festival na pražském Výstavišti. Line-up je autorský návrh se skutečnými interprety, nikoli oznámení jejich potvrzené účasti.</popis_festivalu>
  <sazba_dph>12</sazba_dph>
  <dny>
    <den id="d1">
      <nazev>Den 1</nazev>
      <tema_dne>Opening Night</tema_dne>
      <popis>Tři scény otevírají festival rockovými koncerty, popem a večerní elektronikou.</popis>
      <datumstart>2027-08-01</datumstart>
      <casstart>09:00:00</casstart>
      <caskonec>23:59:00</caskonec>
    </den>
    <den id="d2">
      <nazev>Den 2</nazev>
      <tema_dne>Main Stage Highlights</tema_dne>
      <popis>Největší festivalový den: od ranních objevů až po hlavní večerní koncerty.</popis>
      <datumstart>2027-08-02</datumstart>
      <casstart>09:00:00</casstart>
      <caskonec>23:59:00</caskonec>
    </den>
    <den id="d3">
      <nazev>Den 3</nazev>
      <tema_dne>Finale &amp; Afterparty</tema_dne>
      <popis>Závěrečné koncerty a klubová afterparty zakončí tři dny pražské hudby.</popis>
      <datumstart>2027-08-03</datumstart>
      <casstart>09:00:00</casstart>
      <caskonec>23:59:00</caskonec>
    </den>
  </dny>
  <haly>
    <hala id="h1">
      <nazev>Main Hall</nazev>
      <lokace>Hlavní pavilon festivalového areálu</lokace>
      <velikost>5000</velikost>
      <popis>Světová jména popu, rocku a taneční hudby v hlavním pavilonu návrhu festivalového areálu. Zde hrají hlavní hvězdy večerního programu.</popis>
    </hala>
    <hala id="h2">
      <nazev>River Stage</nazev>
      <lokace>Venkovní scéna u Vltavy</lokace>
      <velikost>3000</velikost>
      <popis>Venkovní scéna u Vltavy v navrženém širším festivalovém areálu. Program patří českému rapu, pop rocku a domácím kapelám.</popis>
    </hala>
    <hala id="h3">
      <nazev>Club Stage</nazev>
      <lokace>Klubový pavilon festivalového areálu</lokace>
      <velikost>1500</velikost>
      <popis>Klubová scéna pro drum and bass, UK garage, bassline a hard techno. Program propojuje britskou basovou scénu s taneční elektronikou.</popis>
    </hala>
  </haly>
  <interpreti>
    <interpret id="i1">
      <nazev>David Guetta</nazev>
      <typ_interpreta>Solo</typ_interpreta>
      <zanr>Dance pop / house</zanr>
      <popis>Francouzský DJ a producent, který propojuje taneční elektroniku s popovými vokály. Jeho tvorba sahá od klubového housu po velké rádiové spolupráce. Je spojený s Paříží a francouzskou houseovou scénou.</popis>
      <odkazy>
        <odkaz platforma="spotify" druh="profile">
          <nazev>Spotify</nazev>
          <url>https://open.spotify.com/artist/1Cs0zKBU1kc0i8ypK3B9ai</url>
          <zdroj>https://www.wikidata.org/wiki/Q8298</zdroj>
        </odkaz>
        <odkaz platforma="youtube" druh="profile">
          <nazev>YouTube</nazev>
          <url>https://www.youtube.com/channel/UC1l7wYrva1qCH-wgqcHaaRg</url>
          <zdroj>https://www.wikidata.org/wiki/Q8298</zdroj>
        </odkaz>
      </odkazy>
    </interpret>
    <interpret id="i2">
      <nazev>Katy Perry</nazev>
      <typ_interpreta>Solo</typ_interpreta>
      <zanr>Dance pop</zanr>
      <popis>Americká zpěvačka a autorka popových hitů. Její hudbu charakterizují výrazné refrény, taneční produkce a barevná vizuální estetika. Pochází z kalifornské Santa Barbary; k jejím známým albům patří Teenage Dream.</popis>
      <odkazy>
        <odkaz platforma="spotify" druh="profile">
          <nazev>Spotify</nazev>
          <url>https://open.spotify.com/artist/6jJ0s89eD6GaHleKKya26X</url>
          <zdroj>https://www.wikidata.org/wiki/Q42493</zdroj>
        </odkaz>
        <odkaz platforma="youtube" druh="profile">
          <nazev>YouTube</nazev>
          <url>https://www.youtube.com/channel/UCYvmuw-JtVrTZQ-7Y4kd63Q</url>
          <zdroj>https://www.wikidata.org/wiki/Q42493</zdroj>
        </odkaz>
      </odkazy>
    </interpret>
    <interpret id="i3">
      <nazev>Skrillex</nazev>
      <typ_interpreta>Solo</typ_interpreta>
      <zanr>Dubstep / bass house</zanr>
      <popis>Americký producent a DJ Sonny Moore. V jeho tvorbě se potkávají dubstep, bass music, house i spolupráce napříč současnou populární hudbou. Vyrůstal v Los Angeles a před sólovou elektronickou tvorbou působil v kapele From First to Last.</popis>
      <odkazy>
        <odkaz platforma="spotify" druh="profile">
          <nazev>Spotify</nazev>
          <url>https://open.spotify.com/artist/5he5w2lnU9x7JFhnwcekXX</url>
          <zdroj>https://www.wikidata.org/wiki/Q19004</zdroj>
        </odkaz>
        <odkaz platforma="youtube" druh="profile">
          <nazev>YouTube</nazev>
          <url>https://www.youtube.com/channel/UC_TVqp_SyG6j5hG-xVRy95A</url>
          <zdroj>https://www.wikidata.org/wiki/Q19004</zdroj>
        </odkaz>
      </odkazy>
    </interpret>
    <interpret id="i4">
      <nazev>Tiësto</nazev>
      <typ_interpreta>Solo</typ_interpreta>
      <zanr>Progressive house</zanr>
      <popis>Nizozemský DJ a producent s kořeny v trance. Postupně rozšířil svůj zvuk o house a další podoby taneční elektroniky. Pochází z nizozemské Bredy.</popis>
      <odkazy>
        <odkaz platforma="spotify" druh="profile">
          <nazev>Spotify</nazev>
          <url>https://open.spotify.com/artist/2o5jDhtHVPhrJdv3cEQ99Z</url>
          <zdroj>https://www.wikidata.org/wiki/Q183508</zdroj>
        </odkaz>
        <odkaz platforma="youtube" druh="profile">
          <nazev>YouTube</nazev>
          <url>https://www.youtube.com/channel/UCO59y9XJIJZS5i86lUOvMGA</url>
          <zdroj>https://www.wikidata.org/wiki/Q183508</zdroj>
        </odkaz>
      </odkazy>
    </interpret>
    <interpret id="i5">
      <nazev>Chase &amp; Status</nazev>
      <typ_interpreta>Skupina</typ_interpreta>
      <zanr>Drum and bass / jungle</zanr>
      <popis>Britské producentské duo působící na pomezí drum and bassu, dubstepu a elektroniky. Jeho nahrávky často propojují výrazné basy s hostujícími vokalisty. Duo vzniklo v Londýně.</popis>
      <odkazy>
        <odkaz platforma="spotify" druh="profile">
          <nazev>Spotify</nazev>
          <url>https://open.spotify.com/artist/3jNkaOXasoc7RsxdchvEVq</url>
          <zdroj>https://www.wikidata.org/wiki/Q1067983</zdroj>
        </odkaz>
        <odkaz platforma="youtube" druh="profile">
          <nazev>YouTube</nazev>
          <url>https://www.youtube.com/channel/UCSnULYPo-BA8zo5IcG4doIQ</url>
          <zdroj>https://www.wikidata.org/wiki/Q1067983</zdroj>
        </odkaz>
      </odkazy>
    </interpret>
    <interpret id="i6">
      <nazev>Sub Focus</nazev>
      <typ_interpreta>Solo</typ_interpreta>
      <zanr>Drum and bass / dancefloor</zanr>
      <popis>Britský producent Nick Douwma, výrazná postava melodického drum and bassu. V jeho tvorbě se objevují také house, dubstep a synthpopové vlivy. Pochází z Londýna.</popis>
      <odkazy>
        <odkaz platforma="spotify" druh="profile">
          <nazev>Spotify</nazev>
          <url>https://open.spotify.com/artist/0QaSiI5TLA4N7mcsdxShDO</url>
          <zdroj>https://www.wikidata.org/wiki/Q1848854</zdroj>
        </odkaz>
        <odkaz platforma="youtube" druh="profile">
          <nazev>YouTube</nazev>
          <url>https://www.youtube.com/channel/UCWkMMrVPVVNxuJFHv4ApiDg</url>
          <zdroj>https://www.wikidata.org/wiki/Q1848854</zdroj>
        </odkaz>
      </odkazy>
    </interpret>
    <interpret id="i7">
      <nazev>Wilkinson</nazev>
      <typ_interpreta>Solo</typ_interpreta>
      <zanr>Drum and bass / dancefloor</zanr>
      <popis>Britský DJ a producent Mark Wilkinson. Jeho drum and bass spojuje energické rytmy s melodickými motivy a zpívanými refrény. Pochází z jihozápadního Londýna.</popis>
      <odkazy>
        <odkaz platforma="spotify" druh="profile">
          <nazev>Spotify</nazev>
          <url>https://open.spotify.com/artist/6m8itYST9ADjBIYevXSb1r</url>
          <zdroj>https://www.wikidata.org/wiki/Q15139979</zdroj>
        </odkaz>
        <odkaz platforma="youtube" druh="profile">
          <nazev>YouTube</nazev>
          <url>https://www.youtube.com/channel/UCtaTjkogAC3Xh5J-ZPdX0BQ</url>
          <zdroj>https://www.wikidata.org/wiki/Q15139979</zdroj>
        </odkaz>
      </odkazy>
    </interpret>
    <interpret id="i8">
      <nazev>DARKZY</nazev>
      <typ_interpreta>Solo</typ_interpreta>
      <zanr>UK bassline</zanr>
      <popis>Britský DJ a producent spojený s UK bass a bassline scénou. Jeho zvuk stojí na hutných basových linkách a rytmice britských klubů. Je spojený s klubovou scénou v Nottinghamu.</popis>
      <odkazy>
        <odkaz platforma="spotify" druh="search">
          <nazev>Vyhledat na Spotify</nazev>
          <url>https://open.spotify.com/search/DARKZY</url>
          <zdroj>https://support.spotify.com/article/search/</zdroj>
        </odkaz>
        <odkaz platforma="youtube" druh="search">
          <nazev>Vyhledat na YouTube</nazev>
          <url>https://www.youtube.com/results?search_query=DARKZY</url>
          <zdroj>https://support.google.com/youtube/answer/111997</zdroj>
        </odkaz>
      </odkazy>
    </interpret>
    <interpret id="i9">
      <nazev>TS7</nazev>
      <typ_interpreta>Solo</typ_interpreta>
      <zanr>Bassline / UK garage</zanr>
      <popis>Britský producent a DJ Thomas Sampson. Ve své tvorbě se věnuje bassline, UK garage a dalším basově orientovaným klubovým stylům. Pochází z Bradfordu na severu Anglie.</popis>
      <odkazy>
        <odkaz platforma="spotify" druh="search">
          <nazev>Vyhledat na Spotify</nazev>
          <url>https://open.spotify.com/search/TS7</url>
          <zdroj>https://support.spotify.com/article/search/</zdroj>